"1591962","424.860297","131.243.141.141","208.189.11.184","TCP","62","1525  >  443 [SYN] Seq=0 Win=64240 Len=0 MSS=1460 SACK_PERM=1"
"1592082","424.880903","208.189.11.184","131.243.141.141","TCP","60","443  >  1525 [SYN, ACK] Seq=0 Ack=1 Win=8192 Len=0 MSS=1460"
"1592089","424.882063","131.243.141.141","208.189.11.184","TCP","60","1525  >  443 [ACK] Seq=1 Ack=1 Win=64240 Len=0"
"1592090","424.882159","131.243.141.141","208.189.11.184","TCP","156","1525  >  443 [PSH, ACK] Seq=1 Ack=1 Win=64240 Len=102"
"1592167","424.895013","208.189.11.184","131.243.141.141","TCP","60","443  >  1525 [ACK] Seq=1 Ack=103 Win=8192 Len=0"
"1592176","424.897011","208.189.11.184","131.243.141.141","TCP","60","[TCP Previous segment not captured] 443  >  1525 [PSH, ACK] Seq=80 Ack=103 Win=65160 Len=6"
"1592177","424.897016","208.189.11.184","131.243.141.141","TCP","133","[TCP Out-Of-Order] 443  >  1525 [PSH, ACK] Seq=1 Ack=103 Win=8192 Len=79"
"1592180","424.897528","131.243.141.141","208.189.11.184","TCP","60","[TCP Dup ACK 1592089#1] 1525  >  443 [ACK] Seq=103 Ack=1 Win=64240 Len=0"
"1592181","424.897534","131.243.141.141","208.189.11.184","TCP","60","1525  >  443 [ACK] Seq=103 Ack=86 Win=64155 Len=0"
"1592182","424.897885","208.189.11.184","131.243.141.141","TCP","119","443  >  1525 [PSH, ACK] Seq=86 Ack=103 Win=65160 Len=65"
"1592190","424.899147","131.243.141.141","208.189.11.184","TCP","125","1525  >  443 [PSH, ACK] Seq=103 Ack=151 Win=64090 Len=71"
"1592192","424.900401","131.243.141.141","208.189.11.184","TCP","1514","1525  >  443 [ACK] Seq=174 Ack=151 Win=64090 Len=1460"
"1592193","424.900416","131.243.141.141","208.189.11.184","TCP","492","1525  >  443 [PSH, ACK] Seq=1634 Ack=151 Win=64090 Len=438"
"1593082","425.077526","208.189.11.184","131.243.141.141","TCP","60","443  >  1525 [ACK] Seq=151 Ack=1634 Win=65160 Len=0"
"1602214","427.116924","131.243.141.141","208.189.11.184","TCP","492","[TCP Retransmission] 1525  >  443 [PSH, ACK] Seq=1634 Ack=151 Win=64090 Len=438"
"1602302","427.134150","208.189.11.184","131.243.141.141","TCP","1502","443  >  1525 [ACK] Seq=151 Ack=2072 Win=65160 Len=1448"
"1602303","427.134406","208.189.11.184","131.243.141.141","TCP","1502","443  >  1525 [ACK] Seq=1599 Ack=2072 Win=65160 Len=1448"
"1602305","427.134781","208.189.11.184","131.243.141.141","TCP","1279","443  >  1525 [PSH, ACK] Seq=3047 Ack=2072 Win=65160 Len=1225"
"1602306","427.135524","208.189.11.184","131.243.141.141","TCP","1502","443  >  1525 [ACK] Seq=4272 Ack=2072 Win=65160 Len=1448"
"1602309","427.136036","131.243.141.141","208.189.11.184","TCP","60","1525  >  443 [ACK] Seq=2072 Ack=3047 Win=64240 Len=0"
"1602311","427.136411","131.243.141.141","208.189.11.184","TCP","60","1525  >  443 [FIN, ACK] Seq=2072 Ack=4272 Win=63015 Len=0"
"1602319","427.137915","131.243.141.141","208.189.11.184","TCP","60","1525  >  443 [RST] Seq=2073 Win=0 Len=0"
"1602365","427.151140","208.189.11.184","131.243.141.141","TCP","1502","443  >  1525 [ACK] Seq=5720 Ack=2072 Win=65160 Len=1448"
"1602366","427.151147","208.189.11.184","131.243.141.141","TCP","60","[TCP Previous segment not captured] 443  >  1525 [ACK] Seq=8343 Ack=2073 Win=65160 Len=0"
"1602367","427.151155","208.189.11.184","131.243.141.141","TCP","60","443  >  1525 [FIN, ACK] Seq=8343 Ack=2073 Win=65160 Len=0"
"1602369","427.151264","208.189.11.184","131.243.141.141","TCP","1229","[TCP Out-Of-Order] 443  >  1525 [PSH, ACK] Seq=7168 Ack=2072 Win=65160 Len=1175"
"1602374","427.152527","131.243.141.141","208.189.11.184","TCP","60","1525  >  443 [RST] Seq=2072 Win=0 Len=0"
"1602375","427.152532","131.243.141.141","208.189.11.184","TCP","60","1525  >  443 [RST] Seq=2073 Win=0 Len=0"
"1602376","427.152537","131.243.141.141","208.189.11.184","TCP","60","1525  >  443 [RST] Seq=2073 Win=0 Len=0"
"1602381","427.153526","131.243.141.141","208.189.11.184","TCP","60","1525  >  443 [RST] Seq=2072 Win=0 Len=0"
